{
  "$schema": "https://json-schema.org/draft/2020-12/schema",
  "$id": "https://ao.local/contracts/promoter-active-stack-v0.1.schema.json",
  "title": "AO Promoter Active Stack v0.1",
  "type": "object",
  "required": [
    "schema_version",
    "stack_id",
    "created_at_utc",
    "slots",
    "previous_stack_ref",
    "promotion_history",
    "trust_boundary"
  ],
  "properties": {
    "schema_version": { "const": "ao.promoter.active-stack.v0.1" },
    "stack_id": { "type": "string" },
    "created_at_utc": { "type": "string" },
    "slots": { "type": "object" },
    "previous_stack_ref": { "type": "string" },
    "promotion_history": { "type": "array" },
    "trust_boundary": { "type": "string" }
  },
  "additionalProperties": true
}
